[
  {
    "match_id": "m001",
    "event_id": 1,
    "period": 1,
    "minute": 0,
    "second": 0,
    "t_s": 0,
    "type": "match_start",
    "team": null,
    "player": null,
    "position": null,
    "start": null,
    "end": null,
    "outcome": null,
    "speed_kmh": null,
    "under_pressure": false,
    "lines_broken": 0,
    "possession_id": null,
    "home": "Bahía FC",
    "away": "Real Cardón"
  },
  {
    "match_id": "m001",
    "event_id": 2,
    "period": 1,
    "minute": 0,
    "second": 1,
    "t_s": 1,
    "type": "pass",
    "team": "Bahía FC",
    "player": "M. Ramírez",
    "position": "DC",
    "start": [
      52.5,
      34
    ],
    "end": [
      45,
      36
    ],
    "outcome": "complete",
    "speed_kmh": 38,
    "under_pressure": false,
    "lines_broken": 0,
    "possession_id": 1,
    "receiver": "R. Salgado"
  },
  {
    "match_id": "m001",
    "event_id": 3,
    "period": 1,
    "minute": 0,
    "second": 4,
    "t_s": 4,
    "type": "pass",
    "team": "Bahía FC",
    "player": "R. Salgado",
    "position": "MC",
    "start": [
      45,
      36
    ],
    "end": [
      30,
      20
    ],
    "outcome": "complete",
    "speed_kmh": 52,
    "under_pressure": false,
    "lines_broken": 0,
    "possession_id": 1,
    "receiver": "S. Beltrán"
  },
  {
    "match_id": "m001",
    "event_id": 4,
    "period": 1,
    "minute": 0,
    "second": 9,
    "t_s": 9,
    "type": "pass",
    "team": "Bahía FC",
    "player": "S. Beltrán",
    "position": "DFC",
    "start": [
      30,
      20
    ],
    "end": [
      60,
      8
    ],
    "outcome": "incomplete",
    "speed_kmh": 71,
    "under_pressure": false,
    "lines_broken": 0,
    "possession_id": 1,
    "receiver": "J. Torres"
  },
  {
    "match_id": "m001",
    "event_id": 5,
    "period": 1,
    "minute": 0,
    "second": 11,
    "t_s": 11,
    "type": "recovery",
    "team": "Real Cardón",
    "player": "B. Haro",
    "position": "LI",
    "start": [
      60,
      8
    ],
    "end": null,
    "outcome": "won",
    "speed_kmh": null,
    "under_pressure": false,
    "lines_broken": 0,
    "possession_id": 2
  },
  {
    "match_id": "m001",
    "event_id": 212,
    "period": 1,
    "minute": 12,
    "second": 18,
    "t_s": 738,
    "type": "duel",
    "team": "Real Cardón",
    "player": "D. Verdugo",
    "position": "EI",
    "start": [
      25,
      10
    ],
    "end": null,
    "outcome": "won",
    "speed_kmh": null,
    "under_pressure": false,
    "lines_broken": 0,
    "possession_id": 31,
    "opponent": "D. Mena"
  },
  {
    "match_id": "m001",
    "event_id": 213,
    "period": 1,
    "minute": 12,
    "second": 23,
    "t_s": 743,
    "type": "pass",
    "team": "Real Cardón",
    "player": "D. Verdugo",
    "position": "EI",
    "start": [
      24,
      9
    ],
    "end": [
      12,
      30
    ],
    "outcome": "complete",
    "speed_kmh": 48,
    "under_pressure": true,
    "lines_broken": 1,
    "possession_id": 31,
    "receiver": "S. Leyva"
  },
  {
    "match_id": "m001",
    "event_id": 214,
    "period": 1,
    "minute": 12,
    "second": 25,
    "t_s": 745,
    "type": "shot",
    "team": "Real Cardón",
    "player": "S. Leyva",
    "position": "DC",
    "start": [
      12,
      30
    ],
    "end": [
      0,
      33
    ],
    "outcome": "saved",
    "speed_kmh": 96,
    "under_pressure": true,
    "lines_broken": 0,
    "possession_id": 31,
    "xg": 0.21
  },
  {
    "match_id": "m001",
    "event_id": 388,
    "period": 1,
    "minute": 17,
    "second": 22,
    "t_s": 1042,
    "type": "recovery",
    "team": "Real Cardón",
    "player": "V. Meza",
    "position": "MCD",
    "start": [
      58,
      40
    ],
    "end": null,
    "outcome": "won",
    "speed_kmh": null,
    "under_pressure": false,
    "lines_broken": 0,
    "possession_id": 88
  },
  {
    "match_id": "m001",
    "event_id": 389,
    "period": 1,
    "minute": 17,
    "second": 26,
    "t_s": 1046,
    "type": "pass",
    "team": "Real Cardón",
    "player": "V. Meza",
    "position": "MCD",
    "start": [
      58,
      40
    ],
    "end": [
      50,
      45
    ],
    "outcome": "complete",
    "speed_kmh": 35,
    "under_pressure": false,
    "lines_broken": 0,
    "possession_id": 88,
    "receiver": "K. Rosas"
  },
  {
    "match_id": "m001",
    "event_id": 390,
    "period": 1,
    "minute": 17,
    "second": 31,
    "t_s": 1051,
    "type": "pass",
    "team": "Real Cardón",
    "player": "K. Rosas",
    "position": "MC",
    "start": [
      50,
      45
    ],
    "end": [
      28,
      58
    ],
    "outcome": "complete",
    "speed_kmh": 67,
    "under_pressure": true,
    "lines_broken": 2,
    "possession_id": 88,
    "receiver": "L. Montaño"
  },
  {
    "match_id": "m001",
    "event_id": 391,
    "period": 1,
    "minute": 17,
    "second": 38,
    "t_s": 1058,
    "type": "pass",
    "team": "Real Cardón",
    "player": "L. Montaño",
    "position": "ED",
    "start": [
      28,
      58
    ],
    "end": [
      8,
      36
    ],
    "outcome": "complete",
    "speed_kmh": 74,
    "under_pressure": false,
    "lines_broken": 1,
    "possession_id": 88,
    "receiver": "S. Leyva",
    "cross": true
  },
  {
    "match_id": "m001",
    "event_id": 392,
    "period": 1,
    "minute": 17,
    "second": 40,
    "t_s": 1060,
    "type": "shot",
    "team": "Real Cardón",
    "player": "S. Leyva",
    "position": "DC",
    "start": [
      8,
      36
    ],
    "end": [
      0,
      35
    ],
    "outcome": "goal",
    "speed_kmh": 102,
    "under_pressure": true,
    "lines_broken": 0,
    "possession_id": 88,
    "xg": 0.38
  },
  {
    "match_id": "m001",
    "event_id": 393,
    "period": 1,
    "minute": 17,
    "second": 40,
    "t_s": 1060,
    "type": "goal",
    "team": "Real Cardón",
    "player": "S. Leyva",
    "position": "DC",
    "start": [
      8,
      36
    ],
    "end": null,
    "outcome": null,
    "speed_kmh": null,
    "under_pressure": false,
    "lines_broken": 0,
    "possession_id": 88,
    "assist": "L. Montaño",
    "scoreline": {
      "home": 0,
      "away": 1
    }
  },
  {
    "match_id": "m001",
    "event_id": 530,
    "period": 1,
    "minute": 24,
    "second": 6,
    "t_s": 1446,
    "type": "pressure",
    "team": "Bahía FC",
    "player": "J. Torres",
    "position": "ED",
    "start": [
      82,
      14
    ],
    "end": null,
    "outcome": null,
    "speed_kmh": null,
    "under_pressure": false,
    "lines_broken": 0,
    "possession_id": 140,
    "target": "B. Haro"
  },
  {
    "match_id": "m001",
    "event_id": 531,
    "period": 1,
    "minute": 24,
    "second": 10,
    "t_s": 1450,
    "type": "recovery",
    "team": "Bahía FC",
    "player": "J. Torres",
    "position": "ED",
    "start": [
      84,
      12
    ],
    "end": null,
    "outcome": "won",
    "speed_kmh": null,
    "under_pressure": false,
    "lines_broken": 0,
    "possession_id": 141
  },
  {
    "match_id": "m001",
    "event_id": 532,
    "period": 1,
    "minute": 24,
    "second": 14,
    "t_s": 1454,
    "type": "pass",
    "team": "Bahía FC",
    "player": "J. Torres",
    "position": "ED",
    "start": [
      84,
      12
    ],
    "end": [
      95,
      30
    ],
    "outcome": "incomplete",
    "speed_kmh": 55,
    "under_pressure": true,
    "lines_broken": 0,
    "possession_id": 141,
    "receiver": "M. Ramírez"
  },
  {
    "match_id": "m001",
    "event_id": 598,
    "period": 1,
    "minute": 27,
    "second": 2,
    "t_s": 1622,
    "type": "duel",
    "team": "Bahía FC",
    "player": "D. Mena",
    "position": "LD",
    "start": [
      28,
      9
    ],
    "end": null,
    "outcome": "won",
    "speed_kmh": null,
    "under_pressure": false,
    "lines_broken": 0,
    "possession_id": 160,
    "opponent": "D. Verdugo"
  },
  {
    "match_id": "m001",
    "event_id": 641,
    "period": 1,
    "minute": 29,
    "second": 1,
    "t_s": 1741,
    "type": "pressure",
    "team": "Bahía FC",
    "player": "J. Torres",
    "position": "ED",
    "start": [
      78,
      18
    ],
    "end": null,
    "outcome": null,
    "speed_kmh": null,
    "under_pressure": false,
    "lines_broken": 0,
    "possession_id": 171,
    "target": "N. Ruelas"
  },
  {
    "match_id": "m001",
    "event_id": 642,
    "period": 1,
    "minute": 29,
    "second": 5,
    "t_s": 1745,
    "type": "recovery",
    "team": "Bahía FC",
    "player": "J. Torres",
    "position": "ED",
    "start": [
      80,
      16
    ],
    "end": null,
    "outcome": "won",
    "speed_kmh": null,
    "under_pressure": false,
    "lines_broken": 0,
    "possession_id": 172
  },
  {
    "match_id": "m001",
    "event_id": 643,
    "period": 1,
    "minute": 29,
    "second": 9,
    "t_s": 1749,
    "type": "shot",
    "team": "Bahía FC",
    "player": "J. Torres",
    "position": "ED",
    "start": [
      88,
      22
    ],
    "end": [
      105,
      41
    ],
    "outcome": "off_target",
    "speed_kmh": 88,
    "under_pressure": true,
    "lines_broken": 0,
    "possession_id": 172,
    "xg": 0.07
  },
  {
    "match_id": "m001",
    "event_id": 738,
    "period": 1,
    "minute": 33,
    "second": 36,
    "t_s": 2016,
    "type": "pressure",
    "team": "Bahía FC",
    "player": "J. Torres",
    "position": "ED",
    "start": [
      86,
      10
    ],
    "end": null,
    "outcome": null,
    "speed_kmh": null,
    "under_pressure": false,
    "lines_broken": 0,
    "possession_id": 197,
    "target": "B. Haro"
  },
  {
    "match_id": "m001",
    "event_id": 739,
    "period": 1,
    "minute": 33,
    "second": 40,
    "t_s": 2020,
    "type": "recovery",
    "team": "Bahía FC",
    "player": "J. Torres",
    "position": "ED",
    "start": [
      87,
      10
    ],
    "end": null,
    "outcome": "won",
    "speed_kmh": null,
    "under_pressure": false,
    "lines_broken": 0,
    "possession_id": 198
  },
  {
    "match_id": "m001",
    "event_id": 740,